{
  "status": "completed",
  "jobId": "job_7c41",
  "requestedBy": "orchidy-pro",
  "requestedAt": "2026-09-01T10:40:00.000Z",
  "updatedAt": "2026-09-01T11:05:00.000Z",
  "model": "gemini-2.5-flash",
  "sourceUrl": "https://img.example.com/cj/142/main.jpg",
  "hostedUrl": "https://media.example.com/videos/job_7c41.mp4",
  "error": null,
  "orkyVideoId": "vid_3f1"
}